{
  "contract_version": "1.0.0",
  "run_id": "run_ux_creation_example",
  "created_at": "2026-08-26T12:00:00Z",
  "created_by": { "id": "example-ux-agent", "kind": "agent", "provider": "replaceable", "model": "unspecified" },
  "loop_profile": { "id": "ux-creation", "version": "1.0.0", "path": "governance/agent-system/loops/ux-creation.v1.json" },
  "task": { "title": "Create one benchmark-grounded user journey", "objective": "For one bounded actor and state, cover every applicable category baseline before differentiation and bounded experiments, then verify first, action, error, recovery, and after screens through the production entrypoint.", "deliverable": "UxJourneyPacketV1" },
  "intent_type": "ux_creation",
  "requirement_ids": ["UX-BASELINE", "UX-LAYERING", "UX-ACTION", "UX-STATES", "UX-LANGUAGE", "UX-ACCESS", "UX-VIEWPORT"],
  "artifact_contract": { "artifact_types": ["UxJourneyPacketV1", "ScreenshotEvidenceSetV1"], "required_paths": ["src", "artifacts/agentops/outcomes/example/ux-journey.json"], "format": "mixed", "version": "1.0.0", "hash_algorithm": "sha256" },
  "expected_outcome": { "statement": "For one bounded actor and state, the category baseline remains complete, the named ChopDot differentiator is measurable, every experiment retains a baseline fallback, and one obvious action plus all journey states work accessibly at declared viewports without infrastructure language.", "assertions": [
    { "id": "UX-BASELINE", "description": "Unresolved applicable baseline count is zero.", "subject": "unresolved_applicable_baseline_count", "operator": "count_equals", "expected": 0, "minimum_evidence_level": "source-only", "hard_fail": true },
    { "id": "UX-LAYERING", "description": "UX layer violation count is zero.", "subject": "ux_layer_violation_count", "operator": "count_equals", "expected": 0, "minimum_evidence_level": "unit", "hard_fail": true },
    { "id": "UX-ACTION", "description": "Primary next action count equals one.", "subject": "primary_next_action_count", "operator": "count_equals", "expected": 1, "minimum_evidence_level": "simulated-integration", "hard_fail": true },
    { "id": "UX-STATES", "description": "Missing required screen state count is zero.", "subject": "missing_required_screen_state_count", "operator": "count_equals", "expected": 0, "minimum_evidence_level": "simulated-integration", "hard_fail": true },
    { "id": "UX-LANGUAGE", "description": "Prohibited user-interface term count is zero.", "subject": "prohibited_ui_term_count", "operator": "count_equals", "expected": 0, "minimum_evidence_level": "unit", "hard_fail": true },
    { "id": "UX-ACCESS", "description": "Blocking accessibility failure count is zero.", "subject": "blocking_accessibility_failure_count", "operator": "count_equals", "expected": 0, "minimum_evidence_level": "unit", "hard_fail": true },
    { "id": "UX-VIEWPORT", "description": "Failed required viewport count is zero.", "subject": "failed_viewport_count", "operator": "count_equals", "expected": 0, "minimum_evidence_level": "simulated-integration", "hard_fail": true }
  ] },
  "scope": { "root": "/Users/devinsonpena/ChopDot/.worktrees/chopdot-v1-launch", "branch": "codex/chopdot-v1-launch", "starting_head": "74d81cba8edd7200246b837c5a31ec4f00456409", "starting_tree": "fc000c64fe3eeb0362ac11905d0d6afaadfb74c9", "in_paths": ["src", "tests/e2e"], "out_paths": ["PRODUCT_TRUTH.md"], "dirty_paths": ["docs/superpowers/plans/2026-08-26-portable-agent-outcome-system.md"] },
  "authority": { "policy_ref": "governance/agent-system/policies/authority-boundaries.json", "allowed_reads": ["repo", "product benchmark baseline", "local rendered app"], "allowed_writes": ["src", "tests/e2e", "redacted screenshots"], "allowed_tools": ["apply_patch", "playwright", "accessibility_checker"], "external_effects": ["none"], "required_approvals": ["publication deployment real-person data capture or intentional baseline exclusion"] },
  "context": { "governing_sources": [{ "path": "PRODUCT_TRUTH.md", "sha256": "d5ea94b3b89f682d7b7ab76f580102316c25b0366c52b9b5a851a5ab7162bba6", "authority_level": "product_law", "observed_at": "2026-08-27T12:00:00Z" }, { "path": "product/benchmark-baseline.md", "sha256": "eb0bad42e37a3d6b61ca98414dfc03ff123a0c67c016ee612aab7b6b54c76b50", "authority_level": "guardrail", "observed_at": "2026-08-27T12:00:00Z" }], "max_age_seconds": 86400, "conflict_policy": "block_same_level_conflict", "wrong_root_policy": "fail_closed" },
  "architecture": { "mode": "evaluator_optimizer", "justification": "Rendered design repair requires a creator and an independent real-screen evaluator." },
  "budgets": { "max_iterations": 3, "max_retries": 2, "max_wall_seconds": 10800, "max_tool_calls": 160, "max_model_cost_usd": 30, "max_external_cost_usd": 0 },
  "evaluator": { "rubric_refs": ["governance/agent-system/evals/rubrics/ux-creation.v1.json"], "deterministic_commands": [{ "id": "UX-BENCHMARK-SEMANTICS", "command": "node scripts/agent-system/benchmark-semantics.mjs --packet artifacts/agentops/outcomes/example/ux-journey.json --type ux-journey", "cwd": "/Users/devinsonpena/ChopDot/.worktrees/chopdot-v1-launch", "expected_exit_code": 0, "timeout_seconds": 120 }, { "id": "UX-ENTRYPOINT", "command": "npx playwright test", "cwd": "/Users/devinsonpena/ChopDot/.worktrees/chopdot-v1-launch", "expected_exit_code": 0, "timeout_seconds": 1800 }], "reviewer_independence": "different_actor", "pass_threshold": 0.9, "hard_fail_assertion_ids": ["UX-BASELINE", "UX-LAYERING", "UX-ACTION", "UX-STATES", "UX-LANGUAGE", "UX-ACCESS", "UX-VIEWPORT"] },
  "environment_observations": [{ "id": "UX-REAL-SCREENS", "surface": "one bounded actor and state through src/main.tsx at required mobile and desktop viewports", "required_readback": ["benchmark IDs dispositions and evidence grades", "layer order and baseline fallbacks", "journey trace", "screenshots", "accessibility results"], "minimum_evidence_level": "simulated-integration" }],
  "failure_outcome": { "required_fields": ["failed_baseline_requirement_ids", "benchmark_evidence_overclaims", "missing_baseline_fallback", "annotated_screen", "failed_journey_step", "viewport_and_actor", "severity", "precise_correction_target"], "same_blocker_limit": 2, "continuation_required": true },
  "terminal_states": ["succeeded", "failed_verification", "blocked", "approval_required", "budget_exhausted", "cancelled"],
  "knowledge_policy": { "port_version": "1.0.0", "preflight_required": true, "record_outcome": true, "verify_recall": true, "degraded_context_allowed": false, "disallowed_fallbacks": ["cross_root", "missing_benchmark_baseline"] },
  "privacy_policy": { "prohibited_content": ["credentials", "private participant data", "unredacted receipts"], "redaction_required": true, "retention": "promote_redacted_outcome", "export_policy": "redacted_only" }
}
